{
  "schemaVersion": "1.0",
  "dispatchId": "2e8e16da-8510-4569-93b8-53312547aa3f",
  "storyId": "M3-001",
  "phase": "interface-verification",
  "status": "completed",
  "summary": "Harness CLI and nine-phase vertical slice verification passed; product API/UI verification was not applicable.",
  "outputs": [
    {
      "path": ".harness/runs/M3-001/phases/07-interface-verification/interface-verification-report.md"
    }
  ],
  "records": []
}
