{
  "schemaVersion": "1.0",
  "dispatchId": "493504dd-4157-4539-97df-738627f12a4b",
  "storyId": "M3-001",
  "phase": "implementation",
  "status": "completed",
  "summary": "T1-T3 implementation completed with targeted tests and code reviews.",
  "outputs": [
    {
      "path": ".harness/runs/M3-001/phases/03-implementation/implementation-notes.md"
    }
  ],
  "records": []
}
